{
  "schema_version": 2,
  "id": "gimmick-demo-01",
  "name": "Gimmick Demo: Belt Loop",
  "grid": {
    "width": 16,
    "height": 16,
    "rows": [
      "2222222222222222",
      "2000000000000002",
      "20D0001111000002",
      "2000000000000002",
      "2000AAAAAAAB0002",
      "20009000000B0002",
      "20009000000B0772",
      "20509000D00B0702",
      "20509000000B0002",
      "20009000000B0002",
      "20009CCCCCCC0002",
      "2000000000000002",
      "2022220000222202",
      "2000002020000002",
      "2000002802000002",
      "2222222222222222"
    ]
  },
  "spawns": {
    "players": [
      {
        "slot": 1,
        "x": 7,
        "y": 12
      }
    ],
    "enemies": [
      {
        "x": 2,
        "y": 1
      },
      {
        "x": 13,
        "y": 1
      },
      {
        "x": 7,
        "y": 5
      }
    ]
  },
  "waves": [
    {
      "enemies": 3
    }
  ]
}
